{"schema_version":"1.0","cycle_id":"cycle:rio-claro-demo-001","tenant_id":"tenant:demo-civic-lab","campaign_id":"campaign:rio-claro-municipal-demo","workspace_id":"workspace:rio-claro-2026-demo","diagnosis_category":"ELECTORAL_RESEARCH","question":"Identify the next synthetic evidence gap without authorizing tactics.","requested_artifact":"RESEARCH_GAP_BRIEF","evidence_refs":["evidence:rio-claro-demo-001"]}
